{
  "run_id": "run_2026-01-13T00-00-00Z_demo",
  "mode": "AUTO",
  "updated_at": "2026-01-13T00:00:00Z",
  "nodes": [
    {
      "id": "orch",
      "name": "orchestrator",
      "type": "orchestrator",
      "status": "RUNNING"
    },
    {
      "id": "impl-a",
      "name": "impl-a",
      "type": "agent.codex",
      "status": "READY"
    },
    {
      "id": "impl-b",
      "name": "impl-b",
      "type": "agent.claude",
      "status": "BLOCKED",
      "blocked_reason": "manual"
    },
    {
      "id": "verify",
      "name": "verify",
      "type": "verifier",
      "status": "IDLE"
    }
  ],
  "edges": [
    {
      "id": "e1",
      "from": "orch",
      "to": "impl-a",
      "selector": "all",
      "delivery": "latest"
    },
    {
      "id": "e2",
      "from": "orch",
      "to": "impl-b",
      "selector": "all",
      "delivery": "latest"
    },
    {
      "id": "e3",
      "from": "impl-a",
      "to": "verify",
      "selector": "all",
      "delivery": "latest"
    },
    {
      "id": "e4",
      "from": "impl-b",
      "to": "verify",
      "selector": "all",
      "delivery": "latest"
    }
  ]
}